{
  "$schema": "https://json-schema.org/draft/2020-12/schema",
  "$id": "https://openclaw.local/schemas/causal-analyst/run.schema.json",
  "title": "CausalAnalystRun",
  "type": "object",
  "additionalProperties": false,
  "required": [
    "run_id",
    "timestamp",
    "seed",
    "command",
    "tier",
    "decision",
    "status",
    "executed",
    "elapsed_ms",
    "mirror_trace",
    "prev_hash",
    "hash",
    "schema_version"
  ],
  "properties": {
    "schema_version": {
      "type": "string",
      "pattern": "^v[0-9]+\\.[0-9]+$"
    },
    "run_id": {
      "type": "string",
      "description": "UUIDv4",
      "pattern": "^[0-9a-fA-F-]{36}$"
    },
    "timestamp": {
      "type": "string",
      "description": "ISO8601 UTC timestamp",
      "pattern": "^\\d{4}-\\d{2}-\\d{2}T\\d{2}:\\d{2}:\\d{2}Z$"
    },
    "seed": {"type": "integer"},
    "command": {"type": "string", "minLength": 1},
    "tier": {"type": "string", "enum": ["SAFE", "SENSITIVE", "BLOCKED"]},
    "decision": {"type": ["string", "null"], "enum": ["GRANTED", "DENIED", "TIMEOUT", null]},
    "status": {"type": "string", "enum": ["ran", "denied", "timeout", "blocked"]},
    "executed": {"type": "boolean"},
    "elapsed_ms": {"type": "integer", "minimum": 0},
    "mirror_trace": {
      "type": "object",
      "additionalProperties": false,
      "required": ["reasoning", "risk_flags", "confidence", "alternative_action"],
      "properties": {
        "reasoning": {"type": "string"},
        "risk_flags": {
          "type": "array",
          "items": {
            "type": "string",
            "enum": ["ESCALATE", "REVIEW", "SAFE_OVERRIDE", "DATA_RISK", "UNKNOWN_CMD"]
          }
        },
        "confidence": {"type": "number", "minimum": 0.0, "maximum": 1.0},
        "alternative_action": {"type": ["string", "null"]}
      }
    },
    "prev_hash": {"type": "string", "pattern": "^[0-9a-f]{64}$"},
    "hash": {"type": "string", "pattern": "^[0-9a-f]{64}$"}
  }
}
