{
  "schema_version": "v1.0",
  "run_id": "2f4d2f3d-0b0c-4b6f-9a62-1b62f1b9c9d0",
  "timestamp": "2026-02-25T08:45:00Z",
  "seed": 123,
  "command": "ls",
  "tier": "SAFE",
  "decision": null,
  "status": "ran",
  "executed": true,
  "elapsed_ms": 12,
  "mirror_trace": {
    "reasoning": "Read-only listing. No side effects.",
    "risk_flags": [],
    "confidence": 0.98,
    "alternative_action": null
  },
  "prev_hash": "0000000000000000000000000000000000000000000000000000000000000000",
  "hash": "1111111111111111111111111111111111111111111111111111111111111111"
}
